[
    {
        "leaf_id": "cle-administration-accountability",
        "board_id": "criminologist",
        "official_area_id": "law_enforcement_administration",
        "leaf_name": "Accountability in Administration",
        "current_question_count": 10,
        "deficit_to_5": 0,
        "deficit_to_10": 0,
        "deficit_to_20": 10,
        "source_ids": [
            "lawphil-ra10173",
            "lawphil-ra11131",
            "nij-crime-scene-guides-2017",
            "prc-2026-examination-schedule",
            "prc-criminology-board-page",
            "prc-criminology-enhanced-tos-2024",
            "prc-criminology-ethics-amendment-2025",
            "prc-criminology-irr-2020"
        ],
        "source_count": 8,
        "primary_source_count": 6,
        "source_authority": "ADEQUATE",
        "source_currentness": "CURRENT_WITH_LIMITS",
        "source_scope_fit": "DIRECT",
        "source_conflict_status": "RESOLVED",
        "study_material_ids": [
            "cle-law-enforcement-application",
            "cle-law-enforcement-foundation"
        ],
        "study_material_count": 2,
        "study_coverage": "SUFFICIENT",
        "study_source_traceability": "COMPLETE",
        "supported_depth_min": 2,
        "supported_depth_max": 4,
        "distinct_content_families": [
            "accountability",
            "documentation",
            "public_information"
        ],
        "distinct_content_family_count": 3,
        "safe_headroom_min": 3,
        "safe_headroom_preferred": 4,
        "safe_headroom_max": 5,
        "allowed_scope": [
            "accountability_and_administration",
            "bounded_application",
            "community_and_information",
            "current_prc_tos",
            "evidence_supported_limits",
            "privacy_and_public_interest",
            "professional_scope",
            "risk_control_and_role_clarity"
        ],
        "excluded_scope": [
            "future_effective_rules",
            "out_of_leaf_competencies",
            "unverified_exact_thresholds"
        ],
        "limitations": [
            "Do not infer a PNP, DILG, DOJ, or agency-specific operating threshold from a general source.",
            "Use stable administrative reasoning unless a current agency issuance is explicitly identified."
        ],
        "readiness": "READY_WITH_LIMITS",
        "readiness_reason": "The official TOS, professional conduct sources, statutory accountability/privacy boundaries, and NIJ guidance support bounded administration scenarios with agency-specific limits.",
        "review_reason": "",
        "defer_reason": "",
        "max_new_questions": 2,
        "planned_new_questions": 0,
        "reviewed_at_batch": 641,
        "evidence_hash": "a03174046f729f6692a2b263bd6b08a6cc49716a7e0fbf783b9cbe926c7768bd"
    },
    {
        "leaf_id": "cle-corrections-classification",
        "board_id": "criminologist",
        "official_area_id": "correctional_administration",
        "leaf_name": "Classification and Risk",
        "current_question_count": 10,
        "deficit_to_5": 0,
        "deficit_to_10": 0,
        "deficit_to_20": 10,
        "source_ids": [
            "bjmp-comprehensive-operations-manual-2015",
            "bucor-mandates-functions",
            "bucor-reintegration-2025",
            "lawphil-ra11131",
            "lawphil-ra9745",
            "prc-2026-examination-schedule",
            "prc-criminology-board-page",
            "prc-criminology-enhanced-tos-2024",
            "prc-criminology-ethics-amendment-2025",
            "prc-criminology-irr-2020",
            "probation-quality-manual-2016"
        ],
        "source_count": 11,
        "primary_source_count": 8,
        "source_authority": "STRONG",
        "source_currentness": "CURRENT_WITH_LIMITS",
        "source_scope_fit": "DIRECT",
        "source_conflict_status": "RESOLVED",
        "study_material_ids": [
            "cle-corrections-application",
            "cle-corrections-foundation"
        ],
        "study_material_count": 2,
        "study_coverage": "SUFFICIENT",
        "study_source_traceability": "COMPLETE",
        "supported_depth_min": 2,
        "supported_depth_max": 4,
        "distinct_content_families": [
            "case_application",
            "classification",
            "risk_need"
        ],
        "distinct_content_family_count": 3,
        "safe_headroom_min": 2,
        "safe_headroom_preferred": 3,
        "safe_headroom_max": 4,
        "allowed_scope": [
            "bounded_application",
            "classification_and_rehabilitation",
            "current_prc_tos",
            "custody_and_dignity",
            "evidence_supported_limits",
            "privacy_and_public_interest",
            "professional_scope",
            "reintegration_and_coordination"
        ],
        "excluded_scope": [
            "future_effective_rules",
            "out_of_leaf_competencies",
            "unverified_exact_thresholds"
        ],
        "limitations": [
            "Agency manuals are version-sensitive; avoid unverified operational thresholds.",
            "Keep questions within correctional administration and do not substitute an agency-specific policy for a general professional principle."
        ],
        "readiness": "READY_WITH_LIMITS",
        "readiness_reason": "The current TOS, professional ethics, statutory boundaries, and BJMP/BuCor/PPA materials support bounded correctional administration scenarios with explicit agency-version limits.",
        "review_reason": "",
        "defer_reason": "",
        "max_new_questions": 2,
        "planned_new_questions": 0,
        "reviewed_at_batch": 641,
        "evidence_hash": "393dc44e8243f60cd2f7ded3e9728dd9e5388cdf679bbb03e71a6d8a62aa9bc7"
    },
    {
        "leaf_id": "cle-corrections-community",
        "board_id": "criminologist",
        "official_area_id": "correctional_administration",
        "leaf_name": "Community Corrections",
        "current_question_count": 10,
        "deficit_to_5": 0,
        "deficit_to_10": 0,
        "deficit_to_20": 10,
        "source_ids": [
            "bjmp-comprehensive-operations-manual-2015",
            "bucor-mandates-functions",
            "bucor-reintegration-2025",
            "lawphil-ra11131",
            "lawphil-ra9745",
            "prc-2026-examination-schedule",
            "prc-criminology-board-page",
            "prc-criminology-enhanced-tos-2024",
            "prc-criminology-ethics-amendment-2025",
            "prc-criminology-irr-2020",
            "probation-quality-manual-2016"
        ],
        "source_count": 11,
        "primary_source_count": 8,
        "source_authority": "STRONG",
        "source_currentness": "CURRENT_WITH_LIMITS",
        "source_scope_fit": "DIRECT",
        "source_conflict_status": "RESOLVED",
        "study_material_ids": [
            "cle-corrections-application",
            "cle-corrections-foundation"
        ],
        "study_material_count": 2,
        "study_coverage": "SUFFICIENT",
        "study_source_traceability": "COMPLETE",
        "supported_depth_min": 2,
        "supported_depth_max": 4,
        "distinct_content_families": [
            "case_application",
            "community_corrections",
            "coordination"
        ],
        "distinct_content_family_count": 3,
        "safe_headroom_min": 2,
        "safe_headroom_preferred": 3,
        "safe_headroom_max": 4,
        "allowed_scope": [
            "bounded_application",
            "classification_and_rehabilitation",
            "current_prc_tos",
            "custody_and_dignity",
            "evidence_supported_limits",
            "privacy_and_public_interest",
            "professional_scope",
            "reintegration_and_coordination"
        ],
        "excluded_scope": [
            "future_effective_rules",
            "out_of_leaf_competencies",
            "unverified_exact_thresholds"
        ],
        "limitations": [
            "Agency manuals are version-sensitive; avoid unverified operational thresholds.",
            "Keep questions within correctional administration and do not substitute an agency-specific policy for a general professional principle."
        ],
        "readiness": "READY_WITH_LIMITS",
        "readiness_reason": "The current TOS, professional ethics, statutory boundaries, and BJMP/BuCor/PPA materials support bounded correctional administration scenarios with explicit agency-version limits.",
        "review_reason": "",
        "defer_reason": "",
        "max_new_questions": 2,
        "planned_new_questions": 0,
        "reviewed_at_batch": 641,
        "evidence_hash": "0f78a89de61dbca31b9c8e92a5d443504200e06fac29bd2338f5c48b7178c688"
    },
    {
        "leaf_id": "cle-corrections-institutional",
        "board_id": "criminologist",
        "official_area_id": "correctional_administration",
        "leaf_name": "Institutional Corrections",
        "current_question_count": 10,
        "deficit_to_5": 0,
        "deficit_to_10": 0,
        "deficit_to_20": 10,
        "source_ids": [
            "bjmp-comprehensive-operations-manual-2015",
            "bucor-mandates-functions",
            "bucor-reintegration-2025",
            "lawphil-ra11131",
            "lawphil-ra9745",
            "prc-2026-examination-schedule",
            "prc-criminology-board-page",
            "prc-criminology-enhanced-tos-2024",
            "prc-criminology-ethics-amendment-2025",
            "prc-criminology-irr-2020",
            "probation-quality-manual-2016"
        ],
        "source_count": 11,
        "primary_source_count": 8,
        "source_authority": "STRONG",
        "source_currentness": "CURRENT_WITH_LIMITS",
        "source_scope_fit": "DIRECT",
        "source_conflict_status": "RESOLVED",
        "study_material_ids": [
            "cle-corrections-application",
            "cle-corrections-foundation"
        ],